title,doi,pubmed_id,abstract,pub_date,authors,researchkeys,score
Nasal Microbiome and Its Interaction with the Host in Childhood Asthma.,10.3390/cells11193155,36231116,"Childhood asthma is a major chronic non-communicable disease in infants and children, often triggered by respiratory tract infections. The nasal cavity is a reservoir for a broad variety of commensal microbes and potential pathogens associated with respiratory illnesses including asthma. A healthy nasal microenvironment has protective effects against respiratory tract infections. The first microbial colonisation in the nasal region is initiated immediately after birth. Subsequently, colonisation by nasal microbiota during infancy plays important roles in rapidly establishing immune homeostasis and the development and maturation of the immune system. Dysbiosis of microbiota residing in the mucosal surfaces, such as the nasopharynx and guts, triggers immune modulation, severe infection, and exacerbation events. Nasal microbiome dysbiosis is related to the onset of symptomatic infections. Dynamic interactions between viral infections and the nasal microbiota in early life affect the later development of respiratory infections. In this review, we summarise the existing findings related to nasal microbiota colonisation, dynamic variations, and host-microbiome interactions in childhood health and respiratory illness with a particular examination of asthma. We also discuss our current understanding of biases produced by environmental factors and technical concerns, the importance of standardised research methods, and microbiome modification for the prevention or treatment of childhood asthma. This review lays the groundwork for paying attention to an essential but less emphasized topic and improves the understanding of the overall composition, dynamic changes, and influence of the nasal microbiome associated with childhood asthma.",2022-10-15,"Yao Zeng, Jessie Qiaoyi Liang","((attention AND (disorder OR disorders)) OR ""ADHD"") AND (kid OR kids OR child OR children OR childhood) AND (treatment OR treatments OR therapy OR therapies) NOT (adult OR adults)",-
Avoidable childhood blindness in a high-income country: findings from the British Childhood Visual Impairment and Blindness Study 2.,10.1136/bjo-2022-321718,36229176,"Addressing childhood visual disability is an international priority, with data on causes needed to plan, implement and evaluate public health and clinical care. We have examined the contribution of 'avoidable' blinding disorders to childhood visual impairment, severe visual impairment and blindness (VI/SVIBL) in the UK.
National prospective observational longitudinal study, the British Childhood Visual Impairment and Blindness Study 2 (BCVIS2), of children (aged 18 years or under) newly diagnosed with vision worse than 0.48 logMAR (logarithm of the minimum angle of resolution) or equivalent in both eyes. Proportions of children with an 'avoidable' disorder comprising either a 
Of the 784 children within BCVIS2, isolated potentially preventable disorders were present in only 17% (132/784) and treatable disorders in an additional 13% (99/784). The most common treatable causes were cataract, retinopathy of prematurity and glaucoma. Of the 132 children with potentially preventable disease, 64 had hypoxic-ischaemic encephalopathy. Non-accidental injury accounted for almost two-thirds (11/16, 69%) of those with VI/SVIBL due to injury.
Despite significant progress in the past decades in high-income countries, there remains a need to be vigilant about implementing preventive strategies and treatments. Attention to disorders that are currently neither preventable nor treatable remains a priority in these settings and will become increasingly important in lower-income and middle-income countries undergoing economic transition.",2022-10-14,"Ameenat Lola Solebo, Lucinda Teoh, Jenefer Sargent, Jugnoo S Rahi, ","((attention AND (disorder OR disorders)) OR ""ADHD"") AND (kid OR kids OR child OR children OR childhood) AND (treatment OR treatments OR therapy OR therapies) NOT (adult OR adults)",-
Neuroprotection in late life attention-deficit/hyperactivity disorder: A review of pharmacotherapy and phenotype across the lifespan.,10.3389/fnhum.2022.938501,36226261,"For decades, psychostimulants have been the gold standard pharmaceutical treatment for attention-deficit/hyperactivity disorder (ADHD). In the United States, an astounding 9% of all boys and 4% of girls will be prescribed stimulant drugs at some point during their childhood. Recent meta-analyses have revealed that individuals with ADHD have reduced brain volume loss later in life (>60 y.o.) compared to the normal aging brain, which suggests that either ADHD or its treatment may be neuroprotective. Crucially, these neuroprotective effects were significant in brain regions (e.g., hippocampus, amygdala) where severe volume loss is linked to cognitive impairment and Alzheimer's disease. Historically, the ADHD diagnosis and its pharmacotherapy came about nearly simultaneously, making it difficult to evaluate their effects in isolation. Certain evidence suggests that psychostimulants may normalize structural brain changes typically observed in the ADHD brain. If ADHD itself is neuroprotective, perhaps exercising the brain, then psychostimulants may not be recommended across the lifespan. Alternatively, if stimulant drugs are neuroprotective, then this class of medications may warrant further investigation for their therapeutic effects. Here, we take a bottom-up holistic approach to review the psychopharmacology of ADHD in the context of recent models of attention. We suggest that future studies are greatly needed to better appreciate the interactions amongst an ADHD diagnosis, stimulant treatment across the lifespan, and structure-function alterations in the aging brain.",2022-10-14,"Cintya Nirvana Dutta, Leonardo Christov-Moore, Hernando Ombao, Pamela K Douglas","((attention AND (disorder OR disorders)) OR ""ADHD"") AND (kid OR kids OR child OR children OR childhood) AND (treatment OR treatments OR therapy OR therapies) NOT (adult OR adults)",-
Behavioral sleep medicine-The need for harmonization of clinical best practice outcome measures in children and adolescents with intellectual or developmental disabilities and restless sleep.,10.3389/fpsyt.2022.1003019,36226108,"In behavioral medicine, sleep disorders, insomnia in particular, may be considered comorbidities and precipitating factors to intellectual or developmental disabilities (IDD). Nevertheless, sleep alterations have often been neglected in favor of daytime features and symptoms, albeit simple behavioral nighttime observations may disclose hypermotor features that characterize restless sleep. The root of most hypermotor restlessness is linked to central iron deficiency. The latter is often exacerbated by vitamin D deficiency (VDD), which interferes with both dopaminergic and serotonergic mechanisms. In this way, an imbalance affecting daytime behavior and mood is created. Several sleep-related motor disorders such as bruxism, periodic and aperiodic leg movements, Restless Legs Syndrome (RLS), and Restless Sleep Disorder (RSD) are commonly seen in Attention Deficit Hyperactivity Disorder (ADHD) and Autism Spectrum Disorders (ASD). However, they are rarely diagnosed and often overlooked in affected children and adolescents. As a result, not only are these disorders not adequately addressed therapeutically, but their symptoms may be worsened by the side-effects of drugs used to contain disruptive daytime behavior, such as antipsychotics and antidepressants. In children with IDDs, obesity, inactivity and metabolic effects of antipsychotics often lead to Sleep Disordered Breathing (SDB), which is currently understood as an inflammatory state leading to ""hyperactive"" lethargy and further alterations of the hypoxic chain and vitamin D levels. Endorsing simple routine blood tests, including inflammatory markers such as C-reactive protein, ferritin, transferrin, and vitamin D levels, may favorably complement caregiver observations and ambulatory sleep recordings, leading to a sleep disorder diagnosis and consequent therapy. In fact, the treatment of SDB, RLS, and RSD has been copiously demonstrated to favorably impact vigilance, behavior, social competence, and academic skills in healthy and, to a greater extent, in IDD children. Thus, consulting and deliberating the root causes of functional and categorical diagnoses within a clinical framework may engender a more precise diagnosis and further benefit pediatric daytime and nighttime management of hyperactive behaviors.",2022-10-14,"Rosalia Silvestri, Osman S Ipsiroglu","((attention AND (disorder OR disorders)) OR ""ADHD"") AND (kid OR kids OR child OR children OR childhood) AND (treatment OR treatments OR therapy OR therapies) NOT (adult OR adults)",-
Treatment biomarkers for ADHD: Taking stock and moving forward.,10.1038/s41398-022-02207-2,36224169,"The development of treatment biomarkers for psychiatric disorders has been challenging, particularly for heterogeneous neurodevelopmental conditions such as attention-deficit/hyperactivity disorder (ADHD). Promising findings are also rarely translated into clinical practice, especially with regard to treatment decisions and development of novel treatments. Despite this slow progress, the available neuroimaging, electrophysiological (EEG) and genetic literature provides a solid foundation for biomarker discovery. This article gives an updated review of promising treatment biomarkers for ADHD which may enhance personalized medicine and novel treatment development. The available literature points to promising pre-treatment profiles predicting efficacy of various pharmacological and non-pharmacological treatments for ADHD. These candidate predictive biomarkers, particularly those based on low-cost and non-invasive EEG assessments, show promise for the future stratification of patients to specific treatments. Studies with repeated biomarker assessments further show that different treatments produce distinct changes in brain profiles, which track treatment-related clinical improvements. These candidate monitoring/response biomarkers may aid future monitoring of treatment effects and point to mechanistic targets for novel treatments, such as neurotherapies. Nevertheless, existing research does not support any immediate clinical applications of treatment biomarkers for ADHD. Key barriers are the paucity of replications and external validations, the use of small and homogeneous samples of predominantly White children, and practical limitations, including the cost and technical requirements of biomarker assessments and their unknown feasibility and acceptability for people with ADHD. We conclude with a discussion of future directions and methodological changes to promote clinical translation and enhance personalized treatment decisions for diverse groups of individuals with ADHD.",2022-10-13,"Giorgia Michelini, Luke J Norman, Philip Shaw, Sandra K Loo","((attention AND (disorder OR disorders)) OR ""ADHD"") AND (kid OR kids OR child OR children OR childhood) AND (treatment OR treatments OR therapy OR therapies) NOT (adult OR adults)",-
Adaptive Behavior in Young Autistic Children: Associations with Irritability and ADHD Symptoms.,10.1007/s10803-022-05753-2,36222990,"Attention-deficit/hyperactivity disorder (ADHD) symptoms affect 40-60% of autistic children and have been linked to differences in adaptive behavior. It is unclear whether adaptive behavior in autistic youth is directly impacted by co-occurring ADHD symptoms or by another associated feature of both autism and ADHD, such as increased irritability. The current study examined relationships between irritability, ADHD symptoms, and adaptive behavior in 3- to 7-year-old autistic children. Results suggest that, after adjusting for co-occurring ADHD symptoms, higher levels of irritability are associated with differences in social adaptive behavior specifically. Understanding relationships between irritability, ADHD, and adaptive behavior in autistic children is critical because measures of adaptive behavior, such as the Vineland Scales of Adaptive Functioning, are often used as a proxy for global functioning, as well as for developing intervention plans and measuring outcomes as primary endpoints in clinical trials.",2022-10-13,"Kimberly L H Carpenter, Naomi O Davis, Marina Spanos, Maura Sabatos-DeVito, Rachel Aiello, Grace T Baranek, Scott N Compton, Helen L Egger, Lauren Franz, Soo-Jeong Kim, Bryan H King, Alexander Kolevzon, Christopher J McDougle, Kevin Sanders, Jeremy Veenstra-VanderWeele, Linmarie Sikich, Scott H Kollins, Geraldine Dawson","((attention AND (disorder OR disorders)) OR ""ADHD"") AND (kid OR kids OR child OR children OR childhood) AND (treatment OR treatments OR therapy OR therapies) NOT (adult OR adults)",-
